ID,Date,Text
-17568841,2019-12-19T09:04:58.000Z,Мы оставляем прямой эфир открытым для всех. Поддержите нас если вам важно то что мы делаем: https://tvrain.ru/donate (https://tvrain.ru/donate)
-17568841,2019-12-24T20:01:06.000Z,Вчера у сотрудника ФБК Руслана Шаведдинова прошел обыск а сегодня его отправили служить за полярный круг на Новую Землю. Рассказываем где находится его часть и обсуждаем что его ждет в армии
-17568841,2019-12-24T19:31:07.000Z,Путин еще ни разу не выступал с посланием к Федеральному собранию в самом начале года но в 2020 году это произойдет 15 января. Почему президент выбрал такую нестандартную дату и о чем он собирается рассказать обсуждаем с политологом Дмитрием Орешкиным
-17568841,2019-12-24T19:01:08.000Z,По всей России уже месяц массово эвакуируют суды больницы школы и торговые центры. Больше всего это коснулось Москвы и Петербурга в прошлый четверг в столице эвакуировали 170 тысяч человек. Казалось бы как с этим всем могут быть связаны биткоины и «Царьград»? Рассказываем как именно:
-17568841,2019-12-24T18:31:06.000Z,«Много невиновных людей в тюрьме очень много. Я читаю их дела и у меня ощущение что Петросян возвращается в юмор» Самариддин Раджабов который сегодня избежал реального срока по «московскому делу» сразу после освобождения приехал к нам в студию. Обвинение запрашивало для него 35 года колонии за брошенную в силовиков пластиковую бутылку. Поговорили о сегодняшнем заседании и четырех месяцах в СИЗО
-17568841,2019-12-24T18:01:05.000Z,Психолог Надежда Железняк объясняет чем бумажные книги лучше электронных и как приучить ребенка к чтению
-17568841,2019-12-24T17:31:15.000Z,1 января в петербургском аэропорту Пулково введут режим открытого неба: https://tvrain.ru/s/ARj/В сентябре мы подробно рассказывали что значит этот режим и станут ли авиабилеты из Пулково самыми выгодными:
-17568841,2019-12-24T17:05:34.000Z,У нас в вечерних новостях интервью с Самариддином Раджабовым. Подключайтесь мы уже начали эфир: https://tvrain.ru/s/kmE/На видео он едет к нам в студию под трек «Ветер перемен» записанный им вместе с Оксимироном Видео: Павел Зорин / Дождь
-17568841,2019-12-24T16:31:06.000Z,Что будет с валютой в 2020 году в чем лучше хранить деньги и от чего будет зависеть курс рубля? Андрей Мовчан и президент ACI Russia Сергей Романчук обсуждают чего ждать от следующего года
-17568841,2019-12-24T16:01:09.000Z,В среду 25 декабря в гостях Hard Day’s Night Федор Бондарчук. Смотрите интервью с ним в прямом эфире в 21:00.P.S. Наш эфир открыт для всех. Поддержите нас если вам важно то что мы делаем: https://tvrain.ru/donate
-17568841,2019-12-24T15:32:29.000Z,Вот и пришло время подводить итоги года. По ссылкам — голосования от команды «Кашин.Гуру».Журналист года: https://tvrain.ru/s/AQ4/СМИ года: https://tvrain.ru/s/AQ8/Голосования закроются 27 декабря в 09:00 по московскому времени
-17568841,2019-12-24T15:01:00.000Z,Андрей Трубников начинал бизнес с продажи жидкости для мытья посуды а сейчас владеет компанией «Первое решение» (Natura Siberica «Рецепты бабушки Агафьи» Organic Shop Planeta Organica) бренды которой знают во всем мире. Он рассказал Льву Пархоменко как убедил весь мир пользоваться шампунями из таежных трав и построил компанию с выручкой 12 миллиардов рублей#minirussia #mini #miniclubman
-17568841,2019-12-24T14:46:03.000Z,Вчера в квартире сотрудника ФБК Руслана Шаведдинова прошли обыски после которых его отвезли на сборный пункт в Москве а сегодня его отправили служить на Новую Землю
-17568841,2019-12-24T14:31:04.000Z,У задержанного генерала Федеральной таможенной службы при обыске нашли 600 тысяч евро 600 тысяч долларов золотые слитки и элитные часы. Его арестовали на два месяца
-17568841,2019-12-24T14:01:11.000Z,Курс доллара впервые за полтора года опустился ниже 62 рублей. На прошлой неделе курс евро опустился ниже 69 рублей — тоже впервые за полтора годаhttps://tvrain.ru/s/AQS/
-17568841,2019-12-24T13:31:04.000Z,Самариддина Раджабова фигуранта «московского дела» оштрафовали и освободили от наказания. Обвинение просило для него 35 года колонии за брошенную в сторону полицейских пластиковую бутылку
-17568841,2019-12-24T13:16:04.000Z,Еще одного фигуранта «московского дела» приговорили к реальному сроку. Сергея Суровцева признали виновным в применении насилия к сотруднику Росгвардии и приговорили к 25 годам колонии
-17568841,2019-12-24T13:01:04.000Z,В этот раз «Нобель» не о лауреатах а о человеке который эту награду должен получить. Дмитрий Быков рассказывает почему премия Джоан Роулинг может стать «искуплением грехов» Нобелевского комитета какие евангельские мотивы прослеживаются в «Гарри Поттере» почему Северус Снейп — это оправданный Иуда а черты Волан-де-Морта есть даже в Путине и Трампе:
-17568841,2019-12-24T12:32:13.000Z,В январе 2020 года исполняется 200 лет с тех пор как Антарктида стала известна человечеству. Посмотрите фотографии из путешествия биолога Станислава Захарова которыми он поделился с Дождем (там редкие животные и природные явления). Фотогалерея — на сайте: https://tvrain.ru/s/AQn/
-17568841,2019-12-24T11:57:04.000Z,«Это фантазии не знаю чьи» — глава СПЧ Валерий Фадеев рассказал что Винокурову никто не планирует исключать из совета. А на вопрос о том кричал ли он на нее Фадеев ответил: «Почитайте есть уже комментарии моих коллег-членов СПЧ»
-17568841,2019-12-24T11:28:05.000Z,Суд заочно приговорил фигуранта «болотного дела» Дмитрия Бученкова к двум годам и шести месяцам лишения свободы. Суд засчитал ему уже отбытый срок в СИЗО за весь срок лишения свободы поэтому его розыск прекращен
-17568841,2019-12-24T11:03:06.000Z,В новом выпуске программы «Деньги. Прямая линия» — финансист Павел Теплухин. Он объяснил что нужно для увеличения низких темпов экономического роста в России почему частным инвесторам невыгодно работать в нашей стране и когда следует ждать мировой экономический кризис:
-17568841,2019-12-24T10:29:04.000Z,«Фадеев не подходит на роль главы СПЧ потому он не понимает что такое права человека и гражданское общество».Екатерина Винокурова о конфликте с главой СПЧ Валерием Фадеевым из-за ее вопроса Путину
-17568841,2019-12-24T10:05:20.000Z,Следственный комитет прекратил уголовное дело против Сергея Половца которого обвиняли в угрозах судье Алексею Криворучко:
-17568841,2019-12-24T09:57:49.000Z,Евгения Ерзунова обвиняемого в угрозах судье Алексею Криворучко из-за твита приговорили к штрафу в 130 тысяч рублей. С учетом ареста сумма штрафа снижена до 110 тысяч рублей он был освобождён в зале суда:
-17568841,2019-12-24T09:38:31.000Z,Прокуратура попросила приговорить к четырем годам колонии фигуранта «московского дела» Сергея Суровцева. Его обвиняют в применении насилия к сотруднику Росгвардии
-17568841,2019-12-24T09:32:05.000Z,Алексей Навальный выложил в твиттер видео на котором запечатлен момент вывода Руслана Шаведдинова из самолета. Его доставили в Архангельск:
-17568841,2019-12-24T09:00:07.000Z,На этой неделе в прокат выходит новый громкий кинопроект Константина Эрнста и продюсера Анатолия Максимова. Это «Союз спасения» — исторический эпос о декабристах в роковом 1825 году. Что там действительно актуального о чем кино и для кого рассказал Денис Катаев который уже успел посмотреть фильм
-17568841,2019-12-24T08:42:05.000Z,Владимир Колокольцев поручил уволить сотрудников МВД в Татарстане которые организовали учения по разгону митинга в одной из школ региона:
-17568841,2019-12-24T08:24:05.000Z,Власти Москвы отказались от строительства 72-этажного дома в рамках программы реновации. Проектировщики учли мнение местных жителей и уменьшили этажность дома вдвое
-17568841,2019-12-24T08:02:06.000Z,В 2017 году в бельгийском Генте внезапно открылась выставка русского авангарда коллекционеров Топоровских в которую вошло 24 произведения известных авторов. Эти работы раньше нигде не выставлялись а вся информация о них была доступна лишь самим владельцам картин. В итоге мировая общественность пришла к выводу что вся выставка — фейк. Спустя два года расследований скандалов и разбирательств владельцы коллекции оказались под арестом — их подозревают в мошенничестве отмывании денег и торговле краденым. Специалист по русском авангарду Андрей Сарабьянов рассказывает как чете Топоровских почти удалось обмануть весь мир:
-17568841,2019-12-24T07:29:04.000Z,Минюст «полностью поддерживает» законопроект о профилактике семейно-бытового насилия хотя еще в ноябре замглавы ведомства Михаил Гальперин заявлял что проблема домашнего насилия в стране «достаточно преувеличена»
-17568841,2019-12-24T07:01:05.000Z,Откуда у монаха взялся миллион долларов чтобы купить себе двухуровневый пентхаус с бассейном и площадкой для барбекю в Испании? Разбираемся как идут дела у главы Отдела внешних церковных связей РПЦ
-17568841,2019-12-24T06:40:12.000Z,Правительство изменило правила сдачи экзамена на водительские права. С октября 2020 года появится получасовой практический экзамен объединяющий в себе этапы «площадка» и «город». Некоторые изменения в правилах вступят в силу уже с 1 января
-17568841,2019-12-24T06:17:40.000Z,Полицейские задержали бывшего фигуранта «московского дела» Сергея Фомина. Его везут в ОВД «Пресня» чтобы составить административный протокол о нарушении правил проведения митинга
-17568841,2019-12-24T06:17:34.000Z,Полицейские задержали бывшего фигуранта «московского дела» Сергея Фомина. Его везут в ОВД «Пресня» чтобы составить административный протокол о нарушении правил проведения митинга
-17568841,2019-12-24T05:59:06.000Z,В Татарстане девятиклассники стали невольными участниками учений полиции причем выступали они в роли протестующих которым заламывали руки и валили на землю. МВД утверждает что никто не пострадал вот только дети рассказали нам о реальных побоях
-17568841,2019-12-24T05:43:21.000Z,Сотрудники полиции вечером 23 декабря пришли к жительнице села Новотроицкое в Татарстане Екатерине Пантелеевой которая опубликовала видео с учениями МВД по разгону митингу проходивших с участием школьников. Они попросили девушку написать объяснительную о том откуда она взяла видео и кто попросил его опубликовать
-17568841,2019-12-24T05:27:03.000Z,В Комсомольске-на-Амуре во время испытательного полета разбился истребитель Су-57
-17568841,2019-12-24T05:02:05.000Z,Сюжет «Спящей красавицы» — один из древнейших в мировой литературе. И посвящён он  не чистой любви как можно было бы подумать а мужской красоте. Дмитрий Макаров рассказывает о разных вариантах и скрытых смыслах этой сказки
-17568841,2019-12-24T03:01:04.000Z,Новость для поклонников советской мультипликации: спустя 50 лет все-таки вышла финальная третья серия «Умки»
-17568841,2019-12-24T01:01:05.000Z,Владимир Путин уже давно в космосе а Меркель Трамп Джонсон и Лукашенко — в коммунальной квартире. Новый выпуск «Заповедника»:
-17568841,2019-12-23T23:01:04.000Z,Спецназ в полном обмундировании и с щитами в спортивном зале показывает как бить протестующих. Так прошло посвящение в кадеты в Челябинской области
-17568841,2019-12-23T21:59:07.000Z,Прямая линия Кадырова шутки про Ротенберга от Путина и планы пересадить чиновников на такси. Подводим итоги дня с Анной Монгайт
-17568841,2019-12-23T21:30:06.000Z,Самариддин Раджабов — тот самый 21-летний рэпер которого судят за брошенную на акции пластиковую бутылку. Сегодня обвинение попросило приговорить его к 35 годам колонии. Мы поговорили с отцом Самариддина который тоже пришел на заседание суда
-17568841,2019-12-23T20:46:06.000Z,«Надеюсь что Путин посмотрит это интервью»Екатерина Винокурова рассказывает Илье Азару как на нее «наорал Фадеев» из-за вопроса президенту про Беслан; говорит что ее уволили из «Знака» из-за работы в СПЧ; объясняет из-за чего перешла работать на RT. Полная версия интервью уже на сайте:
-17568841,2019-12-23T20:30:07.000Z,Чиновников могут лишить личных авто и пересадить на такси. Во всяком случае документ с таким проектом сегодня появился в интернете. Возможно ли такое в стране где престиж и значимость чиновника измеряются роскошью кабинета и автомобиля?
-17568841,2019-12-23T19:59:06.000Z,Противники закона о домашнем насилии продолжают изобретать все новые способы борьбы. В этот раз в ход пошло молитвенное стояние
-17568841,2019-12-23T19:43:30.000Z,«Фадеев на меня начал орать на тему того что я себе позволяю хотя я всего-навсего хотела высказать свое мнение. Фадеев не подходит на роль главы Совета по правам человека и гражданскому обществу потому что он не понимает что такое права человека и гражданское общество»Екатерина Винокурова рассказала о конфликте с новым главой СПЧ Валерием Фадеевым. По ее словам это произошло из-за вопроса Путину про пострадавших в Беслане
-17568841,2019-12-23T19:29:07.000Z,Сегодня Владимир Путин открывал железнодорожное сообщение с Крымом. По количеству и уровню шуток это мероприятие почти сравнялось с пресс-конференцией —  сами послушайте:
-17568841,2019-12-23T19:16:18.000Z,«Фадееву я просто не нравлюсь»Екатерина Винокурова в программе у Ильи Азара. Прямо сейчас — о конфликте с Фадеевым СПЧ и переходе на RT. Подключайтесь: https://tvrain.ru/s/kmE/
-17568841,2019-12-23T18:59:09.000Z,У сотрудника ФБК Руслана Шаведдинова прошел обыск после чего его забрали на допрос. Ему отключили сотовую связь
-17568841,2019-12-23T18:30:07.000Z,Следим за пресс-конференцией Рамзана Кадырова. Оказывается единственная проблема Чечни — безработица а глава республики переживая за российский спорт и проблемы с допингом сам пробовал мельдоний
-17568841,2019-12-23T18:15:19.000Z,Фото дня: Первый поезд Санкт-Петербург — Севастополь отправляется с Московского вокзала. 23 декабря открылось железнодорожное сообщение с Крымом. Фото: Петр Ковалев / ТАСС
-17568841,2019-12-23T17:59:05.000Z,Журналистка телеканала «Ямал-Регион» уволилась через несколько дней после пресс-конференции Путина на которой она спросила о строительстве моста через Обь. По информации СМИ это произошло из-за того что вопрос не понравился местным властям
-17568841,2019-12-23T17:30:06.000Z,«Я делал фильм о людях сегодняшних чтобы они смотрели на себя и делали выводы»Интервью с Константином Эрнстом: говорим о фильме «Союз спасения» который он продюсировал а еще — об исторической памяти ненависти к большевикам и мотивах которые движут людьми выходящими на площадь
-17568841,2019-12-23T17:00:14.000Z,В августе 1998 года вся страна выучила слова «технический дефолт». О причинах и последствиях кризиса рассказывает бывший председатель Центробанка Сергей Дубинин «Околоперестройка» — это наш совместный проект с [club72326580|ОНА РАЗВАЛИЛАСЬ] о 90-х самом противоречивом и интересном десятилетии в нашей новейшей истории
-17568841,2019-12-23T16:30:57.000Z,Обвинение попросило приговорить фигуранта «московского дела» Самариддина Раджабова к 35 годам колонии: https://tvrain.ru/s/APK/
-17568841,2019-12-23T16:17:34.000Z,Журналистка издания Baza Анна Никитина подала заявление в СК из-за травм которые ей нанесли полицейские в квартире Евгения Манюрова. Они пришли с обыском когда Никитина брала интервью у его матери
-17568841,2019-12-23T16:02:55.000Z,«Четыре партии в Думе для такой страны как Россия — это противоестественно. Такой парламент не может быть репрезентативным»Екатерина Шульман анализирует текущее состояние российского общества: на кого мы похожи больше — на Европу или на Китай как будут меняться настроения в ближайшее время и как власть может на это отреагировать
