ID,Date,Text
-25232578,2019-12-23T17:44:31.000Z,В конце декабря принято подводить итоги работы и составлять список планов на следующий год. Это помогает вспомнить какой путь мы прошли и найти точки для роста. Возможно вы хотели кардинально изменить карьеру пойти на тренинг или начать свой бизнес но сомневались в правильности решения а потому откладывали это на потом. Какие вопросы задать себе чтобы поставить бизнес-цели для себя и команды на год и исполнить их? Бизнес-тренер может показать кратчайший путь к достижению цели. В проекте «Просто спросите эксперта» от «РБК Pro» мы предлагаем подписчикам задать вопрос Леониду Кролю бизнес-тренеру и управляющему партнеру проекта Incantico.До середины дня в среду в комментариях к этой публикации мы принимаем вопросы а в пятницу публикуем ответы.Вам слово.
-25232578,2019-12-24T19:52:36.000Z,Журнал Forbes опубликовал рейтинг из десяти наиболее высокооплачиваемых музыкантов уходящего десятилетия. Первое место неожиданно занял рэпер Dr Dre выпустивший последний альбом в 2015 году
-25232578,2019-12-24T19:20:06.000Z,Путин рассказал что Сталин «не запятнал себя прямым общением с Гитлером» в отличие от глав многих европейских государствhttps://www.rbc.ru/rbcfreenews/5e022cea9a794702099a7a36
-25232578,2019-12-24T18:50:02.000Z,Лукашенко предложил России войти в состав Белоруссии. «Почему вы нас приглашаете войти в состав России а сами не рассматриваете такой вариант?» — сказал он
-25232578,2019-12-24T18:24:03.000Z,Власти КНДР предупредили Вашингтон о возможном «рождественском подарке» обвинив США в том что они намеренно затягивают переговоры о денуклеаризации Корейского полуострова. Трамп понадеялся что это будет красивая ваза а не ракетный запуск
-25232578,2019-12-24T17:59:00.000Z,В 2020 году Россия опустится на девятое место в мировом рейтинге расходов на оборону у арестованного генерала ФТС нашли золотые слитки ВКС США отслеживают перемещения Санта-Клауса — самые интересные новости за день
-25232578,2019-12-24T17:35:00.000Z,Президент России в очередной раз назвал полным бредом принятую Европарламентом к 80-летию Второй мировой войны резолюцию. РБК разобрался что написано в документе и чем недоволен Путин
-25232578,2019-12-24T17:01:06.000Z,РБК Pro каждую неделю публикует статьи о самых неординарных современных зарубежных и отечественных предпринимателях и топ-менеджерах и тех принципах управления бизнесом людьми и собственной жизнью которым они следуют. Переходите по ссылке и набирайтесь вдохновения и мотивации на весь следующий год: https://pro.rbc.ru/topic/5ddb64479a79478ad6282d2c?utm_source=vk_rbc
-25232578,2019-12-24T16:40:00.000Z,Министр просвещения Ольга Васильева в прямом эфире ответила на вопросы читателей РБК. Всего министру просвещения поступило более 1800 вопросов https://www.rbc.ru/politics/24/12/2019/5e01c02e9a7947c99de3e918
-25232578,2019-12-24T16:23:55.000Z,Золотые слитки генерала ФТС министр просвещения ответила на вопросы читателей РБК НАТО как гарант суверенитета Белоруссии приговор за пластиковую бутылку; главные новости — в обзоре РБК
-25232578,2019-12-24T16:00:19.000Z,РБК Стиль общается с поколением Z. Герой нового выпуска – Глеб Сидоров звонарь. Восемнадцатилетний юноша с необычной профессией рассказывает о патриотизме роли религии для молодежи и чувствах верующих
-25232578,2019-12-24T15:20:00.000Z,Власти решили заменить служебные машины на такси для чиновников с должностью ниже руководителя структурного подразделения. Также Минфин рассмотрит возможность выплаты компенсации чиновникам за отказ от служебного автомобиля
-25232578,2019-12-24T15:00:06.000Z,Новость о том что 16-летняя эко-активистка Грета Тунберг стала человеком года по версии журнала Time обойдя Трампа Зеленского и Цукерберга наверное никого не удивила. Тема экологии с каждым годом становится все более актуальной как для планеты так и для каждого ее жителя. Чтобы держать вас в курсе самых последних “зеленых ” трендов мы развиваем “Зеленую экономику” тему внутри проекта РБК Тренды. Чтобы и дальше делать свою работу лучше мы просим вас пройти короткий опрос:https://oprosso.net/p/v8FiNyS8AjyynQhSz?utm_source=vk_rbc
-25232578,2019-12-24T14:45:07.000Z,Суд приговорил к 25 годам тюрьмы Максима Суровцева который во время акции поднял секцию металлического ограждения и нанес удар сотруднику Росгвардии
-25232578,2019-12-24T14:25:00.000Z,Министр просвещения России Ольга Васильева рассказала что вводить уроки сексуального воспитания в школах не планируется. Она призвала родителей самостоятельно говорить с детьми о сексуальной культуре соизмеримо «возрасту и современной ситуации» https://www.rbc.ru/rbcfreenews/5e01dda39a7947d8fff6b16b?utm_source=vk_rbc
-25232578,2019-12-24T14:01:00.000Z,Генерал ФТС Александр Кизлык по версии следствия помог уйти от уголовной ответственности жене посла России в Кении Дмитрия Максимычева
-25232578,2019-12-24T13:38:42.000Z,Суд приговорил к штрафу фигуранта «дела 27 июля» Самариддина Раджабова он был освобожден в зале суда. Прокурор просил для Раджабова 35 года колонии за пластиковую бутылку упавшую рядом с полицейскими
-25232578,2019-12-24T13:21:45.000Z,«Сволочь свинья антисемитская по-другому сказать нельзя» — Путин высказался о работавшем до Второй мировой войны в Германии польском дипломате пообещавшем установить памятник Гитлеру за высылку евреев в Африку https://www.rbc.ru/politics/24/12/2019/5e0205f29a7947edfaca4ec9?utm_source=vk_rbc
-25232578,2019-12-24T12:54:29.000Z,При обысках у генерал-лейтенанта ФТС Александра Кизлыка нашли 600 тыс. евро $600 тыс. золотые слитки и часы люксовых брендов. Кизлык способствовал освобождению от уголовной ответственности людей причастных к контрабанде денег
-25232578,2019-12-24T12:12:44.000Z,«Я глубоко убеждена домашние задания должны быть минимальны по времени все что необходимо ребенку должно быть в школе»: Ольга Васильева назвала безумием количество времени которые дети тратят на домашнее заданиеhttps://www.rbc.ru/politics/24/12/2019/5e01c02e9a7947c99de3e918?utm_source=vk_rbc
-25232578,2019-12-24T11:50:00.000Z,В 2019 году объем рынка игрового стриминга в России и СНГ составил 216 млрд руб. оценила QIWI. Зрители стримов — это в основном взрослая аудитория. В ближайшее время рынок будет расти на 20% в год
-25232578,2019-12-24T11:30:05.000Z,Власти намерены оптимизировать расходы на служебные машины для федеральных чиновников. Первый вице-премьер Антон Силуанов поручил проработать вопрос привлечения агрегаторов такси для перевозок госслужащих
-25232578,2019-12-24T11:07:50.000Z,Британская газета Financial Times выбрала словом 2019 года девиз протестов в Гонконге — «будь водой». Этот совет стал популярным в 1971 году когда в одном из эпизодов сериала «Лонгстрит» его произнес герой Брюса Ли
-25232578,2019-12-24T10:45:45.000Z,Следственный комитет обвиняет высокопоставленных таможенников в злоупотреблениях. Среди обвиняемых — генерал-лейтенант таможенной службы возглавлявший управление расследований и дознания
-25232578,2019-12-24T10:26:35.000Z,Спикер Совета Федерации Валентина Матвиенко поддеражала идею к которой с осторожностью отнеслось правительство — сокращние налогов для лиц с низким заработком
-25232578,2019-12-24T10:00:11.000Z,Газопровод Eugal построенный для доставки газа из «Северного потока-2» конечным потребителям заработает с 2020-го несмотря на санкции США. «Газпром» сможет перенаправить в эту трубу газ из «Северного потока-1» считают эксперты
-25232578,2019-12-24T09:40:00.000Z,Глава МВД Владимир Колокольцев уволил организаторов учения с отработкой приемов по разгону акций в школе. Министру МВД Татарстана вынесен дисциплинарный выговор
-25232578,2019-12-24T09:20:44.000Z,Тинькофф Банк стал первым банком присоединившимся к платформе Сбербанка «Плати QR». Сбербанк открыл доступ к своей платформе сторонним организациям после того как свою систему QR-платежей запустил ЦБ
-25232578,2019-12-24T09:00:17.000Z,Министр просвещения Ольга Васильева в прямом эфире ответила на вопросы читателей РБК. Главное из беседы — в материале РБК
-25232578,2019-12-24T08:40:00.000Z,Комиссия по ценным бумагам и биржам США заподозрила немецкого автопроизводителя BMW в искусственном завышении данных о продаже машин. Ранее за аналогичное нарушение $40 млн выплатил Fiat Chrysler
-25232578,2019-12-24T08:20:00.000Z,Среди российских городов аутсайдерами по качеству управления стали Архангельск Владивосток и Ярославль. Тройка лидеров рейтинга составленного близким к власти экспертным центром АПЭК не изменилась по сравнению с прошлым годом
-25232578,2019-12-24T07:33:13.000Z,За счет партнерства с Mail.ru Group количество уникальных пользователей AliExpress в России за год выросло на 30%. Количество покупателей растет у всех площадок но средний чек продолжает падать указывают эксперты
-25232578,2019-12-24T07:05:01.000Z,В банке «Уралсиб» сменился основной владелец: после смерти Владимира Когана «Уралсиб» перешел по наследству к его супруге Людмиле. Ее же банк предлагает ЦБ утвердить в качестве нового санатора
-25232578,2019-12-24T06:44:01.000Z,«Яндекс» оценит кредитоспособность заемщиков риски для «Нафтогаза» из-за соглашения с Россией крушение Су-57 на сколько санкции затормозят «Северный поток-2» реформа водительских экзаменов; главные новости — в обзоре РБК
-25232578,2019-12-24T04:18:57.000Z,Доброе утро! Декабрь в Москве может стать самым тёплым и бесснежным за ВСЮ историю метеонаблюдений. В аптекарском огороде даже зацвели подснежники.
-25232578,2019-12-24T03:29:56.000Z,Реформирование системы сдачи экзаменов на права запустят уже в январе
-25232578,2019-12-23T20:49:23.000Z,«Нафтогаз» допустил нарушение Россией договоренностей по транзиту
-25232578,2019-12-23T19:19:09.000Z,Путин увидел вину России в разгуле бандитизма в Чечне в 1990-е годы
-25232578,2019-12-23T18:33:59.000Z,Президент России Владимир Путин рассказал что вместо чая пьет заваренные алтайские травыhttps://www.rbc.ru/rbcfreenews/5e00eb599a794782c5718aec
-25232578,2019-12-23T17:09:16.000Z,Открылось железнодорожное сообщение с Крымом в России провели учения по изоляции рунета — главные новости дня
-25232578,2019-12-23T16:50:57.000Z,Какой цвет не дает злиться когда появились цветные телевизоры и как делают цветокоррекцию в кино — об этом рассказываем в проекте «Цвет времени»
-25232578,2019-12-23T15:24:38.000Z,Что почитать на праздниках? Мы подобрали для вас самые полезные и популярные публикации РБК Pro по теме «менеджмент» за прошедший год. Сохраните их себе и проведите праздники с пользой и правильным настроем на 2020-й. #дайджест_рбк_pro #рбк_pro→ Как стать руководителем крупной компании. Эксперт Spenser Stuart рассказал по каким критериям сегодня оценивают претендентов на руководящие позиции. https://clck.ru/LNqWg → «Меняйтесь быстро или умирайте медленно»: бизнес-консультант Ицхак Адизес рассказал в чем главная проблема российского менеджмента. https://clck.ru/LNYvX→ Гонка на выживание: как не сгореть в топ-менеджменте. Специалисты Odgers Berndtson рассказали как сохранить физическое и ментальное здоровье «на вершине». https://clck.ru/LNcEs→ Лидерская сила. Что делать лидеру если во время совещания участники команды начали спор и позабыли о нем? Стоит ли показать авторитет или просто наблюдать за происходящим. https://clck.ru/LNccR→ Ловушки для топ-менеджеров: как не разрушить мотивацию подчиненных и какие четыре ошибки регулярно допускают лидеры. https://clck.ru/LNcr5→ Корпоративная культура с характером: в чем проблема менеджмента в России — в исследовании консалтинговой фирмы Oliver Wyman. https://clck.ru/LNcwv→ Пять составляющих успеха: алгоритм для гендиректора XXI века. Как оценивать работу гендиректора? Что считать критерием успеха для него самого и для акционеров? В исследовании BCG. https://clck.ru/LNd4A
-25232578,2019-12-23T15:04:06.000Z,В России сложилась «безобразная ситуация» с бюрократическими помехами работе малого бизнеса сказал Путин на встрече с предпринимателямиhttps://www.rbc.ru/politics/23/12/2019/5e00cb899a794772321b25bc
-25232578,2019-12-23T14:45:15.000Z,Трехсторонняя контактная группа (ТКГ) по урегулированию конфликта на Добнассе согласовала условия освобождения и обмена удерживаемых лиц до конца года рассказали РБК участники переговоров
-25232578,2019-12-23T14:22:55.000Z,Власти выделят ₽3 млрд на поддержку отечественных компаний которые создают интернет-контент для молодежи. По словам Кириенко схема финансирования будет такой же как у Фонда кино — «государство не выдает заказ а софинансирует проекты путем экспертной оценки»
-25232578,2019-12-23T13:52:13.000Z,Программа перевозок в новогодние праздники может быть сорвана из-за 27-30 самолетов которые не включили в приложения к ряду соглашений. Обэтом предупредили 27 российских авиакомпаний
-25232578,2019-12-23T13:31:09.000Z,В 2019 году более 80% сжиженного газа завод «Ямал СПГ» продаст Европе в том числе странам с которыми традиционно работает «Газпром». Ранее НОВАТЭК обещал поставить почти весь газ в Азию и не конкурировать с госконцерном в Европе
-25232578,2019-12-23T12:57:16.000Z,Цена акций «Сургутнефтегаза» впервые за 13 лет превысила ₽50 капитализация компании составила более ₽2 трлн. Рост произошел при отсутствии корпоративных новостей от компании
-25232578,2019-12-23T12:18:30.000Z,Когда Сбербанк покупал почти половину акций Rambler банк никто не предупредил о каких-либо проблемах с Nginx. По словам Грефа конфликт Rambler и Nginx — это ошибка
-25232578,2019-12-23T11:54:19.000Z,Следователи проводят обыски в ФТС в рамках уголовного дела о мошенничестве. По данным СМИ под подозрение попали четыре сотрудника ведомства
-25232578,2019-12-23T11:35:10.000Z,Путин проехал по железнодорожной части Крымского моста. Во время общения со строителями в вагоне поезда президент рассказал о ночном звонке бизнесмена Ротенбергаhttps://www.rbc.ru/society/23/12/2019/5e009e3a9a7947576a02f141?utm_source=vk_rbc
-25232578,2019-12-23T10:52:24.000Z,В Саудовской Аравии пять человек приговорили к смертной казни по делу об убийстве в консульстве королевства в Турции журналиста Джамаля Хашкаджи
-25232578,2019-12-23T10:23:55.000Z,В Москву пришла еще одна волна аномального тепла. В течение дня 23 декабря воздух может прогреться до восьми градусов туманы и дожди по прогнозам синоптиков продержатся до конца дня
-25232578,2019-12-23T10:02:03.000Z,Песков назвал стрельбу на Лубянке трагическим происшествием. По его словам от подобных случаев никто не застрахован
-25232578,2019-12-23T09:34:39.000Z,Утром 24 декабря министр просвещения Ольга Васильева в прямом эфире ответит на вопросы читателей РБК. Смотрите прямую трансляцию на сайте телеканале и в соцсетях
-25232578,2019-12-23T09:05:34.000Z,Петр I под «дипломатическим прикрытием» «добывал значительный объем политической и научно-технической информации» заявил директор Службы внешней разведки Сергей Нарышкин
-25232578,2019-12-23T08:32:03.000Z,Генеральный секретарь НАТО Йенс Столтенберг заявил что готов встретиться с президентом Владимиром Путиным для обсуждения «трудных отношений» альянса с Москвой
-25232578,2019-12-23T08:04:06.000Z,CNN выяснил детали о «рождественском подарке» КНДР для США: Пхеньян планирует отказаться от переговоров по денуклеаризации
-25232578,2019-12-23T07:25:34.000Z,Администрация США поручила приостановить оказание военной помощи Украине через 90 минут после телефонного разговора Трампа с Зеленским сообщает CNN
-25232578,2019-12-23T06:54:02.000Z,Из-за гололедицы и тумана в американском штате Вирджиния на трассе столкнулись 69 автомобилей. Машины следовавшие цепочкой по очереди врезались друг в друга на узком мосту. Пострадал 51 человек
