ID,Date,Text
-61920119,2019-12-19T14:01:26.000Z,Зачем шимпанзе бросают камни в деревья? Немецкие ученые предполагают что таким образом животные создают музыку.http://news.info24.ru/iJ0n
-61920119,2019-12-19T13:12:56.000Z,"23 декабря в России состоятся учения по изоляции ""суверенного Рунета"". На них планируется отрабатывать весь спектр потенциальных воздействий на сети связи.http://news.info24.ru/iJOj"
-61920119,2019-12-19T11:59:38.000Z,"На пресс-конференции 19 декабря Владимир Путин заявил что хотел бы убрать из Конституции РФ слово ""подряд"" касающееся президентских сроков. По его мнению наличие этой оговорки ""смущает"" политологов"".http://news.info24.ru/iJnw"
-61920119,2019-12-19T11:01:42.000Z,В России от Дальнего Востока до Санкт-Петербурга  проходит массовая эвакуация детских садов школ и судов. В столице полицейские и кинологи проверяют информацию об угрозах в аэропортах «Шереметьево» и «Домодедово» и о заложенных взрывных устройствах в семи юридических учреждениях.А в Биробиджане во время эвакуации в детском саду произошла трагедия - погибла воспитатель: http://news.info24.ru/iJTz
-61920119,2019-12-19T10:30:08.000Z,Трое рядовых засудили Минобороны РФ на 6 миллионов рублей. Их обстреляли из танков прямо во время учений.Организаторов учений признали виновными в халатности и приговорили к условным срокам: http://news.info24.ru/iu5a
-61920119,2019-12-19T10:01:01.000Z,В Армении арестовано имущество бывшего президента республики Сержа Саргсяна. Его предшественник Роберт Кочарян руководивший страной с 1998 по 2008 год уже находится под арестом.http://news.info24.ru/iuFX
-61920119,2019-12-19T09:30:25.000Z,"""В России живет очень сильный очень мощный народ. Но некоторая его часть подвержена необоснованной депрессии"" - эксперт при правительстве Москвы не поверил в прогноз убыли населенияhttp://news.info24.ru/iu02"
-61920119,2019-12-19T09:04:26.000Z,В Японии пилотам удалось посадить горящий пассажирский самолет Boeing 767. Момент посадки попал на видеоhttp://news.info24.ru/iuqs
-61920119,2019-12-19T08:06:32.000Z,Дмитрий Медведев подписал постановление которое обяжет владельцев автомобилей с 1 января 2020 года наносить на кузов или раму полицейскую маркировку.https://info24.ru/news/vladelcev-rossijskih-avto-zastavyat-nanosit-na-kuzov-policejskuju-markirovku.html
-61920119,2019-12-19T06:50:28.000Z,"Новый эпизод ""Звездных войн"": ""Скайуокер. Восход"" ужастик ""Чёрное Рождество"" и другие новинки проката в нашем обзоре:https://info24.ru/news/segodnya-v-kino-novyj-epizod-zvezdnyh-vojn-i-francuzskij-gorod-boga.html"
-61920119,2019-12-19T05:39:21.000Z,Палата представителей проголосовала за отстранение от должности президента Дональда Трампа.Теперь для отрешения Трампа от власти необходимо чтобы за это проголосовали две трети сенаторов.https://info24.ru/news/palata-predstavitelej-progolosovala-za-impichment-donalda-trampa.html
-61920119,2019-12-18T18:10:35.000Z,У него почти получилось...
-61920119,2019-12-18T17:41:15.000Z,✈️ Российский пилот предложил отбирать у пассажиров алкоголь на время полетаhttp://news.info24.ru/iD72
-61920119,2019-12-18T17:10:58.000Z,Правительство США через суд получило право на доходы от продажи книги Эдварда Сноудена.В 2013 году он раскрыл информацию о тотальной слежке спецслужб за информационными коммуникациями своих граждан. http://news.info24.ru/iDC1
-61920119,2019-12-18T16:40:19.000Z,Глава Верхнего Уфалея (Челябинская область) Вера Ускова подала в суд на депутата который проголосовал против повышения зарплаты городскому главе.http://news.info24.ru/iDlN
-61920119,2019-12-18T14:33:47.000Z,Дана Борисова снова в центре скандала: ее дочь Полина ушла жить к отцу устав от скандалов с матерью а сегодня телеграм-канал Mash сообщил что врачи помогли снять известной телеведущей ломку.http://news.info24.ru/iiFl
-61920119,2019-12-18T13:15:00.000Z,ВНИМАНИЕ‼На юго-западной части Екатеринбурга обнаружен новый жилой район «Солнечный».☀ Здесь каждый найдёт свою идеальную квартиру быстро и без мук выбора. Все потому что лучшие специалисты отрасли: архитекторы планировщики дизайнеры постарались и подготовили выборку уникальных разноплановых решений.👉🏻Заходите на Топ-квартир: https://vk.cc/a7NTrc выбирайте в формах тип жилья и кто будет жить. Здесь варианты студий однокомнатных двухкомнатныхтрехкомнатных квартир созданные для жизни и продуманные до мелочей. Закоренелый вы холостяк или большая семья с тремя детьми каждый найдёт своё место своё жильё.🏡❤
-61920119,2019-12-18T13:11:07.000Z,"Гатчинский суд избрал меру пресечения Андрею Бовту обвиняемого в изнасиловании своей несовершеннолетней дочери. ""Гатчинского Мэнсона"" который годами держал свою семью в заточении отправили в СИЗО на 2 месяца.http://news.info24.ru/iiU0"
